{
  "$schema": "http://json-schema.org/draft-07/schema#",
  "title": "build step answer",
  "description": "One plan item, built test-first. failedBefore and passedAfter are both const true: there is no shape in this contract for a change whose test did not fail first.",
  "type": "object",
  "additionalProperties": false,
  "required": [
    "step",
    "skills",
    "status",
    "task"
  ],
  "properties": {
    "step": {
      "const": "build"
    },
    "skills": {
      "description": "Every Superpowers skill invoked in this step. The driver cross-checks this against the Skill calls in the run log, so a claim here the log does not show is a failed step.",
      "type": "array",
      "minItems": 1,
      "items": {
        "type": "string",
        "pattern": "^superpowers:[a-z][a-z-]*$"
      }
    },
    "status": {
      "enum": [
        "built",
        "park"
      ]
    },
    "task": {
      "description": "The plan task this answer builds, by its title.",
      "type": "string",
      "minLength": 1
    },
    "testFirst": {
      "type": "object",
      "additionalProperties": false,
      "required": [
        "test",
        "command",
        "testCommit",
        "implCommit",
        "failedBefore",
        "redOutput",
        "passedAfter",
        "greenOutput"
      ],
      "properties": {
        "test": {
          "type": "object",
          "additionalProperties": false,
          "required": [
            "file",
            "behaviour",
            "redWhen"
          ],
          "properties": {
            "file": {
              "type": "string",
              "minLength": 1
            },
            "behaviour": {
              "type": "string",
              "minLength": 1
            },
            "redWhen": {
              "description": "The production change that makes this test fail — the fix deleted, not a typo introduced. A test whose author cannot name one is measuring the shape of the code.",
              "type": "string",
              "minLength": 1
            }
          }
        },
        "command": {
          "type": "string",
          "minLength": 1
        },
        "testCommit": {
          "description": "The commit that adds the test, and nothing else. The driver re-runs the test itself at the change's parent and requires it to fail, so it needs a commit to read the test out of — failedBefore is the claim, this is what makes it checkable.",
          "type": "string",
          "minLength": 7
        },
        "implCommit": {
          "description": "The commit that makes the test pass. It must differ from testCommit: one squashed commit cannot show which came first, which is the thing being prevented.",
          "type": "string",
          "minLength": 7
        },
        "failedBefore": {
          "const": true
        },
        "redOutput": {
          "type": "string",
          "minLength": 1
        },
        "passedAfter": {
          "const": true
        },
        "greenOutput": {
          "type": "string",
          "minLength": 1
        }
      }
    },
    "changed": {
      "type": "array",
      "minItems": 1,
      "items": {
        "type": "object",
        "additionalProperties": false,
        "required": [
          "path",
          "action"
        ],
        "properties": {
          "path": {
            "type": "string",
            "minLength": 1
          },
          "action": {
            "enum": [
              "create",
              "modify",
              "delete"
            ]
          }
        }
      }
    },
    "surfaces": {
      "description": "Every other place that shows the state this change alters, and what was changed there. A state change that updates one surface of three is the most repeated review send-back.",
      "type": "array",
      "items": {
        "type": "string",
        "minLength": 1
      }
    },
    "changelog": {
      "description": "Either the entry file written, or the reason there is none. Never both, and never neither.",
      "type": "object",
      "additionalProperties": false,
      "minProperties": 1,
      "maxProperties": 1,
      "properties": {
        "file": {
          "type": "string",
          "minLength": 1
        },
        "skipped": {
          "type": "string",
          "minLength": 1
        }
      }
    },
    "question": {
      "description": "Why this step cannot finish. Answerable in a line: a yes/no or a pick.",
      "type": "string",
      "minLength": 1
    },
    "questionFor": {
      "description": "Who answers the question. `owner`: pixels, a picture, a product or commercial call, or the data model. `pm`: the ticket's shape — which repo, how it splits, the order, the wording of its acceptance. Unsure is `owner`; the driver treats anything but `pm` as the owner's.",
      "enum": [
        "owner",
        "pm"
      ]
    },
    "notes": {
      "type": "string"
    },
    "testOnly": {
      "description": "A task whose deliverable IS the test: the code it covers already exists, so nothing can be red before it. The driver plants `break` in the production code at testCommit and requires the test to FAIL, then removes it and requires the test to PASS. Use this instead of testFirst only when the task changes no production code.",
      "type": "object",
      "additionalProperties": false,
      "required": [
        "test",
        "command",
        "testCommit",
        "break"
      ],
      "properties": {
        "test": {
          "type": "object",
          "additionalProperties": false,
          "required": [
            "file",
            "behaviour"
          ],
          "properties": {
            "file": {
              "type": "string",
              "minLength": 1
            },
            "behaviour": {
              "type": "string",
              "minLength": 1
            }
          }
        },
        "command": {
          "type": "string",
          "minLength": 1
        },
        "testCommit": {
          "description": "The commit that adds the test. The driver runs the test in a copy of this commit.",
          "type": "string",
          "minLength": 7
        },
        "break": {
          "description": "A literal find/replace in the production file the test covers that DELETES the behaviour under test (the death, not a typo). Never the test file itself. `find` must appear in `file` at testCommit.",
          "type": "object",
          "additionalProperties": false,
          "required": [
            "file",
            "find",
            "replace"
          ],
          "properties": {
            "file": {
              "type": "string",
              "minLength": 1
            },
            "find": {
              "type": "string",
              "minLength": 1
            },
            "replace": {
              "type": "string"
            }
          }
        }
      }
    },
    "replacedTests": {
      "description": "Every test file in which this step removed, reworded or skipped an it()/test() case. `file` is the repo-relative path exactly as git shows it. Give exactly one of `coveredBy` — a bare repo-relative path, nothing else, to the test file at head that now pins the same behaviour (the same file, for a reworded case) — or `removedBecause`, one line on why the behaviour is gone. The ship step writes these into the pull request's `## Deleted tests` section, and the deleted-tests gate checks each line. Empty when no case was removed, reworded or skipped.",
      "type": "array",
      "items": {
        "type": "object",
        "additionalProperties": false,
        "required": [
          "file"
        ],
        "properties": {
          "file": {
            "type": "string"
          },
          "coveredBy": {
            "type": "string"
          },
          "removedBecause": {
            "type": "string"
          }
        }
      }
    }
  },
  "if": {
    "properties": {
      "status": {
        "const": "built"
      }
    }
  },
  "then": {
    "required": [
      "changed",
      "changelog"
    ],
    "oneOf": [
      {
        "required": [
          "testFirst"
        ]
      },
      {
        "required": [
          "testOnly"
        ]
      }
    ]
  },
  "else": {
    "required": [
      "question"
    ]
  }
}
